{
  "$schema": "https://json-schema.org/draft/2020-12/schema",
  "$id": "graph-engineering-v5/run-limits.v1",
  "type": "object",
  "additionalProperties": false,
  "required": ["schema_version", "profile_id", "version", "values"],
  "properties": {
    "schema_version": {"const": "v5.run_limits.v1"},
    "profile_id": {"type": "string", "minLength": 1},
    "version": {"const": 1},
    "values": {
      "type": "array",
      "minItems": 21,
      "maxItems": 21,
      "prefixItems": [
        {"allOf": [{"type": "object", "additionalProperties": false, "required": ["name", "amount", "unit"], "properties": {"name": {"type": "string", "minLength": 1}, "amount": {"type": "integer", "minimum": 1}, "unit": {"type": "string", "minLength": 1}}}, {"properties": {"name": {"const": "causal_radius"}, "amount": {"type": "integer", "minimum": 1}, "unit": {"const": "graph_hops"}}}]},
        {"allOf": [{"type": "object", "additionalProperties": false, "required": ["name", "amount", "unit"], "properties": {"name": {"type": "string", "minLength": 1}, "amount": {"type": "integer", "minimum": 1}, "unit": {"type": "string", "minLength": 1}}}, {"properties": {"name": {"const": "failed_repair_cycles"}, "amount": {"type": "integer", "minimum": 1}, "unit": {"const": "count_per_node"}}}]},
        {"allOf": [{"type": "object", "additionalProperties": false, "required": ["name", "amount", "unit"], "properties": {"name": {"type": "string", "minLength": 1}, "amount": {"type": "integer", "minimum": 1}, "unit": {"type": "string", "minLength": 1}}}, {"properties": {"name": {"const": "diagnostic_widening"}, "amount": {"type": "integer", "minimum": 1}, "unit": {"const": "evidence_connected_ring"}}}]},
        {"allOf": [{"type": "object", "additionalProperties": false, "required": ["name", "amount", "unit"], "properties": {"name": {"type": "string", "minLength": 1}, "amount": {"type": "integer", "minimum": 1}, "unit": {"type": "string", "minLength": 1}}}, {"properties": {"name": {"const": "reasoning_escalation"}, "amount": {"type": "integer", "minimum": 1}, "unit": {"const": "count_per_stall_fingerprint"}}}]},
        {"allOf": [{"type": "object", "additionalProperties": false, "required": ["name", "amount", "unit"], "properties": {"name": {"type": "string", "minLength": 1}, "amount": {"type": "integer", "minimum": 1}, "unit": {"type": "string", "minLength": 1}}}, {"properties": {"name": {"const": "discovery_commands"}, "amount": {"type": "integer", "minimum": 1}, "unit": {"const": "commands_per_cone"}}}]},
        {"allOf": [{"type": "object", "additionalProperties": false, "required": ["name", "amount", "unit"], "properties": {"name": {"type": "string", "minLength": 1}, "amount": {"type": "integer", "minimum": 1}, "unit": {"type": "string", "minLength": 1}}}, {"properties": {"name": {"const": "discovery_duration"}, "amount": {"type": "integer", "minimum": 1}, "unit": {"const": "milliseconds_per_cone"}}}]},
        {"allOf": [{"type": "object", "additionalProperties": false, "required": ["name", "amount", "unit"], "properties": {"name": {"type": "string", "minLength": 1}, "amount": {"type": "integer", "minimum": 1}, "unit": {"type": "string", "minLength": 1}}}, {"properties": {"name": {"const": "repair_attempts"}, "amount": {"type": "integer", "minimum": 1}, "unit": {"const": "patch_attempts_per_cone"}}}]},
        {"allOf": [{"type": "object", "additionalProperties": false, "required": ["name", "amount", "unit"], "properties": {"name": {"type": "string", "minLength": 1}, "amount": {"type": "integer", "minimum": 1}, "unit": {"type": "string", "minLength": 1}}}, {"properties": {"name": {"const": "repair_commands"}, "amount": {"type": "integer", "minimum": 1}, "unit": {"const": "commands_per_cone"}}}]},
        {"allOf": [{"type": "object", "additionalProperties": false, "required": ["name", "amount", "unit"], "properties": {"name": {"type": "string", "minLength": 1}, "amount": {"type": "integer", "minimum": 1}, "unit": {"type": "string", "minLength": 1}}}, {"properties": {"name": {"const": "repair_duration"}, "amount": {"type": "integer", "minimum": 1}, "unit": {"const": "milliseconds_per_cone"}}}]},
        {"allOf": [{"type": "object", "additionalProperties": false, "required": ["name", "amount", "unit"], "properties": {"name": {"type": "string", "minLength": 1}, "amount": {"type": "integer", "minimum": 1}, "unit": {"type": "string", "minLength": 1}}}, {"properties": {"name": {"const": "artifact_output_per_command"}, "amount": {"type": "integer", "minimum": 1}, "unit": {"const": "bytes_per_command"}}}]},
        {"allOf": [{"type": "object", "additionalProperties": false, "required": ["name", "amount", "unit"], "properties": {"name": {"type": "string", "minLength": 1}, "amount": {"type": "integer", "minimum": 1}, "unit": {"type": "string", "minLength": 1}}}, {"properties": {"name": {"const": "artifact_output_per_run"}, "amount": {"type": "integer", "minimum": 1}, "unit": {"const": "bytes_per_run"}}}]},
        {"allOf": [{"type": "object", "additionalProperties": false, "required": ["name", "amount", "unit"], "properties": {"name": {"type": "string", "minLength": 1}, "amount": {"type": "integer", "minimum": 1}, "unit": {"type": "string", "minLength": 1}}}, {"properties": {"name": {"const": "agent_dispatches_per_cone"}, "amount": {"type": "integer", "minimum": 1}, "unit": {"const": "dispatches_per_cone"}}}]},
        {"allOf": [{"type": "object", "additionalProperties": false, "required": ["name", "amount", "unit"], "properties": {"name": {"type": "string", "minLength": 1}, "amount": {"type": "integer", "minimum": 1}, "unit": {"type": "string", "minLength": 1}}}, {"properties": {"name": {"const": "agent_dispatches_per_run"}, "amount": {"type": "integer", "minimum": 1}, "unit": {"const": "dispatches_per_run"}}}]},
        {"allOf": [{"type": "object", "additionalProperties": false, "required": ["name", "amount", "unit"], "properties": {"name": {"type": "string", "minLength": 1}, "amount": {"type": "integer", "minimum": 1}, "unit": {"type": "string", "minLength": 1}}}, {"properties": {"name": {"const": "model_calls_per_cone"}, "amount": {"type": "integer", "minimum": 1}, "unit": {"const": "calls_per_cone"}}}]},
        {"allOf": [{"type": "object", "additionalProperties": false, "required": ["name", "amount", "unit"], "properties": {"name": {"type": "string", "minLength": 1}, "amount": {"type": "integer", "minimum": 1}, "unit": {"type": "string", "minLength": 1}}}, {"properties": {"name": {"const": "model_calls_per_run"}, "amount": {"type": "integer", "minimum": 1}, "unit": {"const": "calls_per_run"}}}]},
        {"allOf": [{"type": "object", "additionalProperties": false, "required": ["name", "amount", "unit"], "properties": {"name": {"type": "string", "minLength": 1}, "amount": {"type": "integer", "minimum": 1}, "unit": {"type": "string", "minLength": 1}}}, {"properties": {"name": {"const": "model_reasoning_tokens_per_cone"}, "amount": {"type": "integer", "minimum": 1}, "unit": {"const": "tokens_per_cone"}}}]},
        {"allOf": [{"type": "object", "additionalProperties": false, "required": ["name", "amount", "unit"], "properties": {"name": {"type": "string", "minLength": 1}, "amount": {"type": "integer", "minimum": 1}, "unit": {"type": "string", "minLength": 1}}}, {"properties": {"name": {"const": "model_reasoning_tokens_per_run"}, "amount": {"type": "integer", "minimum": 1}, "unit": {"const": "tokens_per_run"}}}]},
        {"allOf": [{"type": "object", "additionalProperties": false, "required": ["name", "amount", "unit"], "properties": {"name": {"type": "string", "minLength": 1}, "amount": {"type": "integer", "minimum": 1}, "unit": {"type": "string", "minLength": 1}}}, {"properties": {"name": {"const": "model_reasoning_cost_per_cone"}, "amount": {"type": "integer", "minimum": 1}, "unit": {"const": "normalized_provider_cost_per_cone"}}}]},
        {"allOf": [{"type": "object", "additionalProperties": false, "required": ["name", "amount", "unit"], "properties": {"name": {"type": "string", "minLength": 1}, "amount": {"type": "integer", "minimum": 1}, "unit": {"type": "string", "minLength": 1}}}, {"properties": {"name": {"const": "model_reasoning_cost_per_run"}, "amount": {"type": "integer", "minimum": 1}, "unit": {"const": "normalized_provider_cost_per_run"}}}]},
        {"allOf": [{"type": "object", "additionalProperties": false, "required": ["name", "amount", "unit"], "properties": {"name": {"type": "string", "minLength": 1}, "amount": {"type": "integer", "minimum": 1}, "unit": {"type": "string", "minLength": 1}}}, {"properties": {"name": {"const": "global_work_commands"}, "amount": {"type": "integer", "minimum": 1}, "unit": {"const": "commands_per_run"}}}]},
        {"allOf": [{"type": "object", "additionalProperties": false, "required": ["name", "amount", "unit"], "properties": {"name": {"type": "string", "minLength": 1}, "amount": {"type": "integer", "minimum": 1}, "unit": {"type": "string", "minLength": 1}}}, {"properties": {"name": {"const": "global_work_duration"}, "amount": {"type": "integer", "minimum": 1}, "unit": {"const": "milliseconds_per_run"}}}]}
      ],
      "items": false
    }
  }
}
